Sheet: Main
A1: TAS | B1: Version | C1: Legal | D1: Time | E1: Frames | F1: Difference | G1: Notes
A2: dropzle | B2: 0 | D2: 0:35.275(2075) | E2: 2075
B3: 1 | E3: 2061 | F3: of:=[.E3]-[.E2] -> -14 | G3: 09 - Perpendicular: Abuse rounding error from switch 2 fall to hit Kevin earlier [-1f]. 2nd multiboost: do multiboost up-right into 3 up dashes instead of 4 up dashes [-9f]. 1st multiboost: do crouched version to reach switch earlier and collect it during down dash uncrouch [-4f on previous improvement, 1f of which was from moderately height-precise variant].
B4: 2 | E4: 2049 | F4: of:=[.E4]-[.E3] -> -12 | G4: -1f, 06 - Socket: Uncrouched right dash into second Kevin to demo dash left, cornerboost and cornercorrect on earliest frame. -11f, 09 - Perpendicular: Tested bunch of dash uses and saves. Optimize final drop, with a bit of wavedash [-3f]. Reroute first 3 dashes [-8f].
B5: 3 | E5: 1903 | F5: of:=[.E5]-[.E4] -> -146 | G5: 09 - Perpendicular: x manip before up dash saves time on colliding but not on fall - so not added. Improved last fall slightly by using three half gravity frames instead of one jump frame. -63f FileTime, -146f ChapterTime, 00 - Overpass: Abuse the 2 StNormal frames before StDummy at the beginning to hyper into a spinner and die, avoiding cutsene & pre-cutsene wait. I don't think you can enter the next room instead of dying, since you can't pause to stun.
B6: 4 | D6: 0:32.334(1902) | E6: 1902 | F6: of:=[.E6]-[.E5] -> -1 | G6: 02 - Breadth: Fall slightly lower by cutting 1 dash frame. 03 - Labyrinth: Exit with speed to the left. 04 - Widdershins: Move further left at start. 05 - Symmetry: Don't hyper after gultra. -1f, 06 - Socket: Hyper as early as possible after entrance down-right dash despite following gultra.
F7: of:=[.E7]-[.E6] -> -1902
F8: of:=[.E8]-[.E7] -> 0
F9: of:=[.E9]-[.E8] -> 0